{
  "schema_version": "1.1",
  "generated_at": "2026-08-28T12:20:18.653252+00:00",
  "engine": {
    "package": "kaggle-environments",
    "version": "1.32.7+nodeps",
    "scenario": "kaggriculture",
    "episode_steps": 720
  },
  "config": {
    "rounds": 4,
    "seeds": [
      101,
      102,
      103,
      104
    ],
    "contenders": [
      "submission",
      "baseline_wheat"
    ],
    "opponents": [
      "pass",
      "random",
      "starter",
      "greedy_carrot",
      "cow_baron",
      "melon_hoarder",
      "expansionist"
    ],
    "matrix_order": [
      "submission",
      "cow_baron",
      "melon_hoarder",
      "expansionist",
      "baseline_wheat",
      "greedy_carrot",
      "starter",
      "random",
      "pass"
    ]
  },
  "opponent_pool_names": [
    "cow_baron",
    "melon_hoarder",
    "expansionist",
    "baseline_wheat",
    "greedy_carrot",
    "starter",
    "random",
    "pass"
  ],
  "pool_max_elo": {
    "name": "cow_baron",
    "rating": 1419.6
  },
  "games": [
    {
      "p0": "submission",
      "p1": "cow_baron",
      "seed": 101,
      "rewards": [
        37545.0,
        33724.0
      ],
      "winner": "submission",
      "turns": 720,
      "elapsed_seconds": 1.932
    },
    {
      "p0": "submission",
      "p1": "cow_baron",
      "seed": 102,
      "rewards": [
        27231.0,
        26201.0
      ],
      "winner": "submission",
      "turns": 720,
      "elapsed_seconds": 2.717
    },
    {
      "p0": "submission",
      "p1": "cow_baron",
      "seed": 103,
      "rewards": [
        28068.0,
        21642.0
      ],
      "winner": "submission",
      "turns": 720,
      "elapsed_seconds": 3.334
    },
    {
      "p0": "submission",
      "p1": "cow_baron",
      "seed": 104,
      "rewards": [
        39609.0,
        37564.0
      ],
      "winner": "submission",
      "turns": 720,
      "elapsed_seconds": 3.375
    },
    {
      "p0": "submission",
      "p1": "melon_hoarder",
      "seed": 101,
      "rewards": [
        44702.0,
        36061.0
      ],
      "winner": "submission",
      "turns": 720,
      "elapsed_seconds": 3.389
    },
    {
      "p0": "submission",
      "p1": "melon_hoarder",
      "seed": 102,
      "rewards": [
        38662.0,
        35915.0
      ],
      "winner": "submission",
      "turns": 720,
      "elapsed_seconds": 2.859
    },
    {
      "p0": "submission",
      "p1": "melon_hoarder",
      "seed": 103,
      "rewards": [
        66410.0,
        35515.0
      ],
      "winner": "submission",
      "turns": 720,
      "elapsed_seconds": 2.891
    },
    {
      "p0": "submission",
      "p1": "melon_hoarder",
      "seed": 104,
      "rewards": [
        45076.0,
        35858.0
      ],
      "winner": "submission",
      "turns": 720,
      "elapsed_seconds": 3.249
    },
    {
      "p0": "submission",
      "p1": "expansionist",
      "seed": 101,
      "rewards": [
        58255.0,
        16381.0
      ],
      "winner": "submission",
      "turns": 720,
      "elapsed_seconds": 3.634
    },
    {
      "p0": "submission",
      "p1": "expansionist",
      "seed": 102,
      "rewards": [
        56319.0,
        19046.0
      ],
      "winner": "submission",
      "turns": 720,
      "elapsed_seconds": 3.749
    },
    {
      "p0": "submission",
      "p1": "expansionist",
      "seed": 103,
      "rewards": [
        26109.0,
        18936.0
      ],
      "winner": "submission",
      "turns": 720,
      "elapsed_seconds": 3.419
    },
    {
      "p0": "submission",
      "p1": "expansionist",
      "seed": 104,
      "rewards": [
        47139.0,
        21069.0
      ],
      "winner": "submission",
      "turns": 720,
      "elapsed_seconds": 2.858
    },
    {
      "p0": "submission",
      "p1": "baseline_wheat",
      "seed": 101,
      "rewards": [
        43302.0,
        10377.0
      ],
      "winner": "submission",
      "turns": 720,
      "elapsed_seconds": 2.695
    },
    {
      "p0": "submission",
      "p1": "baseline_wheat",
      "seed": 102,
      "rewards": [
        45563.0,
        10810.0
      ],
      "winner": "submission",
      "turns": 720,
      "elapsed_seconds": 2.428
    },
    {
      "p0": "submission",
      "p1": "baseline_wheat",
      "seed": 103,
      "rewards": [
        31516.0,
        10620.0
      ],
      "winner": "submission",
      "turns": 720,
      "elapsed_seconds": 2.427
    },
    {
      "p0": "submission",
      "p1": "baseline_wheat",
      "seed": 104,
      "rewards": [
        32757.0,
        10560.0
      ],
      "winner": "submission",
      "turns": 720,
      "elapsed_seconds": 2.945
    },
    {
      "p0": "submission",
      "p1": "greedy_carrot",
      "seed": 101,
      "rewards": [
        27364.0,
        9131.0
      ],
      "winner": "submission",
      "turns": 720,
      "elapsed_seconds": 2.821
    },
    {
      "p0": "submission",
      "p1": "greedy_carrot",
      "seed": 102,
      "rewards": [
        81776.0,
        6528.0
      ],
      "winner": "submission",
      "turns": 720,
      "elapsed_seconds": 2.618
    },
    {
      "p0": "submission",
      "p1": "greedy_carrot",
      "seed": 103,
      "rewards": [
        82668.0,
        6546.0
      ],
      "winner": "submission",
      "turns": 720,
      "elapsed_seconds": 2.906
    },
    {
      "p0": "submission",
      "p1": "greedy_carrot",
      "seed": 104,
      "rewards": [
        35581.0,
        7852.0
      ],
      "winner": "submission",
      "turns": 720,
      "elapsed_seconds": 3.068
    },
    {
      "p0": "submission",
      "p1": "starter",
      "seed": 101,
      "rewards": [
        61500.0,
        3672.0
      ],
      "winner": "submission",
      "turns": 720,
      "elapsed_seconds": 2.363
    },
    {
      "p0": "submission",
      "p1": "starter",
      "seed": 102,
      "rewards": [
        63467.0,
        4038.0
      ],
      "winner": "submission",
      "turns": 720,
      "elapsed_seconds": 2.131
    },
    {
      "p0": "submission",
      "p1": "starter",
      "seed": 103,
      "rewards": [
        31145.0,
        3688.0
      ],
      "winner": "submission",
      "turns": 720,
      "elapsed_seconds": 2.812
    },
    {
      "p0": "submission",
      "p1": "starter",
      "seed": 104,
      "rewards": [
        68818.0,
        3464.0
      ],
      "winner": "submission",
      "turns": 720,
      "elapsed_seconds": 2.906
    },
    {
      "p0": "submission",
      "p1": "random",
      "seed": 101,
      "rewards": [
        75925.0,
        0.0
      ],
      "winner": "submission",
      "turns": 720,
      "elapsed_seconds": 3.067
    },
    {
      "p0": "submission",
      "p1": "random",
      "seed": 102,
      "rewards": [
        80654.0,
        0.0
      ],
      "winner": "submission",
      "turns": 720,
      "elapsed_seconds": 3.036
    },
    {
      "p0": "submission",
      "p1": "random",
      "seed": 103,
      "rewards": [
        77770.0,
        0.0
      ],
      "winner": "submission",
      "turns": 720,
      "elapsed_seconds": 3.056
    },
    {
      "p0": "submission",
      "p1": "random",
      "seed": 104,
      "rewards": [
        61424.0,
        0.0
      ],
      "winner": "submission",
      "turns": 720,
      "elapsed_seconds": 2.974
    },
    {
      "p0": "submission",
      "p1": "pass",
      "seed": 101,
      "rewards": [
        63282.0,
        3000.0
      ],
      "winner": "submission",
      "turns": 720,
      "elapsed_seconds": 2.872
    },
    {
      "p0": "submission",
      "p1": "pass",
      "seed": 102,
      "rewards": [
        71883.0,
        3000.0
      ],
      "winner": "submission",
      "turns": 720,
      "elapsed_seconds": 2.626
    },
    {
      "p0": "submission",
      "p1": "pass",
      "seed": 103,
      "rewards": [
        65849.0,
        3000.0
      ],
      "winner": "submission",
      "turns": 720,
      "elapsed_seconds": 2.066
    },
    {
      "p0": "submission",
      "p1": "pass",
      "seed": 104,
      "rewards": [
        51971.0,
        3000.0
      ],
      "winner": "submission",
      "turns": 720,
      "elapsed_seconds": 2.015
    },
    {
      "p0": "cow_baron",
      "p1": "melon_hoarder",
      "seed": 101,
      "rewards": [
        56561.0,
        36468.0
      ],
      "winner": "cow_baron",
      "turns": 720,
      "elapsed_seconds": 2.102
    },
    {
      "p0": "cow_baron",
      "p1": "melon_hoarder",
      "seed": 102,
      "rewards": [
        56464.0,
        37462.0
      ],
      "winner": "cow_baron",
      "turns": 720,
      "elapsed_seconds": 1.829
    },
    {
      "p0": "cow_baron",
      "p1": "melon_hoarder",
      "seed": 103,
      "rewards": [
        48661.0,
        36266.0
      ],
      "winner": "cow_baron",
      "turns": 720,
      "elapsed_seconds": 2.207
    },
    {
      "p0": "cow_baron",
      "p1": "melon_hoarder",
      "seed": 104,
      "rewards": [
        56647.0,
        36408.0
      ],
      "winner": "cow_baron",
      "turns": 720,
      "elapsed_seconds": 2.237
    },
    {
      "p0": "cow_baron",
      "p1": "expansionist",
      "seed": 101,
      "rewards": [
        57110.0,
        13383.0
      ],
      "winner": "cow_baron",
      "turns": 720,
      "elapsed_seconds": 3.243
    },
    {
      "p0": "cow_baron",
      "p1": "expansionist",
      "seed": 102,
      "rewards": [
        34287.0,
        19023.0
      ],
      "winner": "cow_baron",
      "turns": 720,
      "elapsed_seconds": 3.23
    },
    {
      "p0": "cow_baron",
      "p1": "expansionist",
      "seed": 103,
      "rewards": [
        32797.0,
        19219.0
      ],
      "winner": "cow_baron",
      "turns": 720,
      "elapsed_seconds": 2.66
    },
    {
      "p0": "cow_baron",
      "p1": "expansionist",
      "seed": 104,
      "rewards": [
        52474.0,
        20546.0
      ],
      "winner": "cow_baron",
      "turns": 720,